title,company,location,link
Applications Support,"JPMorgan Chase Bank, N.A.","Jersey City, NJ",https://stackoverflow.com/jobs/544858
KI-Entwickler (m/d/w),CompuGroup Medical Deutschland AGviaComputer Futures Solutions GmbH,"Koblenz, Deutschland",https://stackoverflow.com/jobs/524932
BI Developer,Quin.md,"Amsterdam, Netherlands",https://stackoverflow.com/jobs/538298
Tech Lead Backend Development (m/f/d),"AppLike Group - justDice, adjoe and Sunday","Hamburg, Deutschland",https://stackoverflow.com/jobs/531049
Fullstack Web Developer (m/w/d) - JAVA / HTML / CSS,CTS EVENTIM AG & Co. KG aA,"Bremen, Deutschland",https://stackoverflow.com/jobs/531044
